{
  "version": "2026-01-27",
  "event": {
    "event_type": "email",
    "synced_email_id": 1010,
    "thread_id": "thread_outreach_1",
    "received_at": "2026-01-27T16:00:00Z",
    "email_date": "2026-01-27T15:58:00Z",
    "from": { "email": "recruiter@acme.com", "name": "Jane Recruiter" },
    "to": [{ "email": "user@example.com", "name": "User" }],
    "subject": "Opportunity: Senior Engineer at Acme",
    "body": {
      "text": "Hi! We came across your profile and think you'd be a great fit.\nHere is the job posting: https://boards.greenhouse.io/acme/jobs/123\nWould you be interested in a quick chat?\n",
      "source": "body_preview",
      "truncated": false,
      "normalization": { "replies_removed": true, "html_stripped": false, "whitespace_collapsed": true }
    },
    "links": [
      { "url": "https://boards.greenhouse.io/acme/jobs/123", "label_hint": "Job posting" }
    ]
  },
  "match": { "matched": false, "match_strategy": null, "interview_application_id": null, "confidence": 0.0 },
  "application": null,
  "facts": {
    "extraction": { "provider": "openai", "model": "unknown", "confidence": 0.82, "warnings": [] },
    "classification": { "kind": "recruiter_outreach", "confidence": 0.9, "evidence": ["great fit"] },
    "entities": {
      "company": { "name": "Acme", "website": "https://acme.com" },
      "recruiter": { "name": "Jane Recruiter", "email": "recruiter@acme.com", "title": "Recruiter" },
      "job": { "title": "Senior Engineer", "department": null, "location": null, "url": "https://boards.greenhouse.io/acme/jobs/123" }
    },
    "action_links": [
      { "url": "https://boards.greenhouse.io/acme/jobs/123", "action_label": "View job posting", "priority": 1 }
    ],
    "key_insights": "Recruiter outreach with a direct job posting link.",
    "is_forwarded": false,
    "scheduling": {
      "is_scheduling_related": false,
      "scheduled_at": null,
      "timezone_hint": null,
      "duration_minutes": 0,
      "stage": null,
      "round_type": null,
      "stage_name": null,
      "interviewer_name": null,
      "interviewer_role": null,
      "video_link": null,
      "phone_number": null,
      "location": null,
      "is_rescheduled": false,
      "is_cancelled": false,
      "original_scheduled_at": null,
      "evidence": []
    },
    "round_feedback": {
      "has_round_feedback": false,
      "result": null,
      "stage_mentioned": null,
      "round_type": null,
      "interviewer_mentioned": null,
      "date_mentioned": null,
      "feedback": { "has_detailed_feedback": false, "summary": null, "strengths": [], "improvements": [], "full_feedback_text": null },
      "next_steps": { "has_next_round": false, "next_round_type": null, "next_round_hint": null, "timeline_hint": null },
      "evidence": []
    },
    "status_change": {
      "has_status_change": false,
      "type": null,
      "is_final": null,
      "effective_date": null,
      "rejection_details": { "reason": null, "stage_rejected_at": null, "is_generic": false, "door_open": false },
      "offer_details": {
        "role_title": null,
        "department": null,
        "start_date": null,
        "response_deadline": null,
        "includes_compensation_info": false,
        "compensation_hints": null,
        "next_steps": null
      },
      "feedback": { "has_feedback": false, "feedback_text": null, "is_constructive": false },
      "evidence": []
    }
  }
}

