{
  "version": "2026-01-27",
  "event": {
    "event_type": "email",
    "synced_email_id": 1003,
    "thread_id": "thread_rej",
    "received_at": "2026-01-27T14:00:00Z",
    "email_date": "2026-01-27T13:59:00Z",
    "from": { "email": "recruiting@acme.com", "name": "Acme Recruiting" },
    "to": [{ "email": "user@example.com", "name": "User" }],
    "subject": "Update on your application - Acme",
    "body": {
      "text": "Thank you for interviewing with us. After careful consideration, we've decided to move forward with other candidates.\n\nWe appreciate your time.\n",
      "source": "body_preview",
      "truncated": false,
      "normalization": { "replies_removed": true, "html_stripped": false, "whitespace_collapsed": true }
    },
    "links": []
  },
  "match": { "matched": true, "match_strategy": "thread_id", "interview_application_id": 2003, "confidence": 0.92 },
  "application": {
    "id": 2003,
    "status": "active",
    "pipeline_stage": "interviewing",
    "company": { "id": 3001, "name": "Acme", "website": "https://acme.com" },
    "job_role": { "id": 4001, "title": "Software Engineer" },
    "rounds_recent": [
      {
        "id": 5002,
        "position": 2,
        "stage": "technical",
        "stage_name": "Technical Round",
        "scheduled_at": "2026-01-26T18:00:00Z",
        "result": "pending",
        "interviewer_name": null,
        "source_email_id": 998
      }
    ]
  },
  "facts": {
    "extraction": { "provider": "openai", "model": "unknown", "confidence": 0.84, "warnings": [] },
    "classification": { "kind": "status_update", "confidence": 0.85, "evidence": ["move forward with other candidates"] },
    "entities": {
      "company": { "name": "Acme", "website": "https://acme.com" },
      "recruiter": { "name": null, "email": "recruiting@acme.com", "title": null },
      "job": { "title": "Software Engineer", "department": null, "location": null, "url": null }
    },
    "action_links": [],
    "key_insights": null,
    "is_forwarded": false,
    "scheduling": {
      "is_scheduling_related": false,
      "scheduled_at": null,
      "timezone_hint": null,
      "duration_minutes": 0,
      "stage": null,
      "round_type": null,
      "stage_name": null,
      "interviewer_name": null,
      "interviewer_role": null,
      "video_link": null,
      "phone_number": null,
      "location": null,
      "is_rescheduled": false,
      "is_cancelled": false,
      "original_scheduled_at": null,
      "evidence": []
    },
    "round_feedback": {
      "has_round_feedback": false,
      "result": null,
      "stage_mentioned": null,
      "round_type": null,
      "interviewer_mentioned": null,
      "date_mentioned": null,
      "feedback": { "has_detailed_feedback": false, "summary": null, "strengths": [], "improvements": [], "full_feedback_text": null },
      "next_steps": { "has_next_round": false, "next_round_type": null, "next_round_hint": null, "timeline_hint": null },
      "evidence": []
    },
    "status_change": {
      "has_status_change": true,
      "type": "rejection",
      "is_final": true,
      "effective_date": "2026-01-27T14:00:00Z",
      "rejection_details": {
        "reason": "Moving forward with other candidates",
        "stage_rejected_at": null,
        "is_generic": true,
        "door_open": false
      },
      "offer_details": {
        "role_title": null,
        "department": null,
        "start_date": null,
        "response_deadline": null,
        "includes_compensation_info": false,
        "compensation_hints": null,
        "next_steps": null
      },
      "feedback": { "has_feedback": false, "feedback_text": null, "is_constructive": false },
      "evidence": ["move forward with other candidates"]
    }
  }
}
